,title,link,image,author,discount,publisher,pubdate,isbn,description
0,"삶, 그 자취 (이정순 시집)",https://search.shopping.naver.com/book/catalog/32492747608,https://shopping-phinf.pstatic.net/main_3249274/32492747608.20221229071348.jpg,이정순,9000,밥북,20190607,9791158585563,"일상의 자취와 흔적을 찾는 이정순 시인 첫 시집

이정순 시인의 첫 시집으로 4부로 나누어 총 105편의 시를 실었다. 일상을 소재로 가족과 사랑, 친구와 꽃, 세상 사는 이야기 등을 꾸밈없고 간결한 시어로 표현하면서 제목처럼 삶의 자취와 흔적을 노래하고 있다. 독자는 또렷하면서도 거침없는 시인만의 시어를 통해 나와 다르지 않은 시인의 일상을 편안하게 엿보며 자기 삶의 자그마한 휴식과 위안을 얻을 수 있다. 
시인은 “중간에 십여 년을 절필했고, 일부는 소실되며 아쉬움이 남지만, 환갑 때쯤은 시집을 한 권 내겠다는 오래된 소망과 약속을 담아 이 시집을 완성했다”고 밝힌다."
1,주님의 자취 상 (이재록 목사의 요한복음강해),https://search.shopping.naver.com/book/catalog/32466685814,https://shopping-phinf.pstatic.net/main_3246668/32466685814.20221019101535.jpg,이재록,9000,우림,20090122,9788975571985,"이 책은 일반 독자층을 대상으로 한 책으로, 전문적인 내용을 비전공인 일반 독자들도 쉽게 이해할 수 있도록 풀어쓴 교양 도서이다."
2,주님의 자취 1,https://search.shopping.naver.com/book/catalog/32455468201,https://shopping-phinf.pstatic.net/main_3245546/32455468201.20221019142106.jpg,이재록,3600,우림북,20121214,9788975576607,"사도 요한의 생생한 증언을 담은 『주님의 자취』 제1권. 예수님의 생애를 가장 가까이에서 바라본 그를 통해 주님의 삶을 따라갈 수 있다. 묵상과 말씀 등을 수록해 자신을 점검하고, 하나님의 말씀을 마음에 새길 수 있도록 구성되었다."
3,자취의 맛 (유튜버 자취남이 300명의 집을 가보고 느낀 것들),https://search.shopping.naver.com/book/catalog/32794257618,https://shopping-phinf.pstatic.net/main_3279425/32794257618.20230919123407.jpg,자취남(정성권),13970,21세기북스,20220608,9788950902957,"“남의 집을 들여다본다는 건 
마치 새로운 사람을 사귀는 일처럼 흥미롭다”
30만 유튜버 ‘자취남’이 엿본 남의 집, 남의 삶

1인 가구가 전체 인구의 30%에 달하는 시대다. 요즘은 여러 가지 이유로 혼자 살고 있는 이들이 많다. 우리는 이들을 ‘자취생’이라고 부른다. 자취방이라고 하면 흔히 코딱지만 한 방 한 칸을 떠올린다. 하지만 요즘 자취생들은 그 작은 공간에서 자기만의 취향을 더하고 가치관을 반영해 각자의 삶을 꾸려나가고 있다. 

《자취의 맛》은 우리나라에서 남의 자취집을 제일 많이 방문해본 유튜버 ‘자취남’이 300곳이 넘는 자취집을 찾아가 방 안 구석구석을 들여다보며 엿본 자취생들의 삶을 이야기하는 책이다. 집 자체는 다 같은 평수의 방 한 칸인데, 그 안에서 어떻게 살고 있는지, 집에서 어떻게 시간을 보내고 어떤 아이템을 써서 살림을 하는지에 따라 전혀 다른 집이 된다. 이 책에서는 나이도, 직업도, 사는 곳도, 사는 방식도 다양한 가지각색의 사람들의 집을 들여다보며 수많은 1인 가구의 가장들과 각자 사는 모습을 나누고 서로 이야기하며 그들의 특별한 세계를 전한다."
4,자취 요리왕 3 (완결),https://search.shopping.naver.com/book/catalog/36409224619,https://shopping-phinf.pstatic.net/main_3640922/36409224619.20221228072714.jpg,가위,14850,뒹굴,20230125,9791164798636,"가진 거라곤 얄상한 얼굴과 고양이 현호밖에 없는 흙수저 대학생 정지호. 자취생의, 자취생에 의한, 자취생을 위한 요리 서바이벌 프로그램 〈자취요리왕〉에 참가하여 상금 5천만 원을 획득하기 위한 꿈에 부풀어 참가 신청서를 내고, 방송 무대까지 진출하게 된다! 하지만 우승을 위해선 단순한 요리 실력이 아닌 팬덤을 형성할 수 있는 무언가가 더 필요한데…. ""야, 내가 좋은 생각이 있는데. 비즈니스 게이 퍼포먼스라고…….""



정지호의 비게퍼 파트너 최우혁. 생긴 건 기럭지 최강 남신 모델급이지만 재수없고 양아치같이 생긴 X새끼에 인성은 파탄난 소시오패스고 말 한마디 할 때마다 주둥이를 팍 쳐서 싸물게 만들고 싶은 호로방탱이인데. 서로의 이익을 위해 그렇게 최우혁과 정지호는 비지니스 파트너가 된다.



많은 독자들의 사랑을 받은 만큼 단행본 출간을 기념해 가위 작가가 새롭게 그린 일러스트를 활요한 다양한 굿즈와 함께 구성한 리미티드 에디션도 발매하게 되었다. 굿즈는 독자들이 가장 좋아하는 아이템인 아크릴 스탠드 3종, 일러스트 럭스 카드 3종, 인생네컷 등으로 구성했다. 특히 아크릴 스탠드는 주인공 지호, 우혁과 더불어 서브 캐릭터인 종한까지도 모두 구성해 독자들의 기대가 클 것이다. 아크릴 스탠드와 더불어 모든 굿즈는 기존에 없던 새로운 일러스트로 제작해 소장 가치를 더욱 높였다."
5,자취 요리왕 2,https://search.shopping.naver.com/book/catalog/36410329634,https://shopping-phinf.pstatic.net/main_3641032/36410329634.20221230073003.jpg,가위,14850,뒹굴,20230125,9791164798629,"가진 거라곤 얄상한 얼굴과 고양이 현호밖에 없는 흙수저 대학생 정지호. 자취생의, 자취생에 의한, 자취생을 위한 요리 서바이벌 프로그램 〈자취요리왕〉에 참가하여 상금 5천만 원을 획득하기 위한 꿈에 부풀어 참가 신청서를 내고, 방송 무대까지 진출하게 된다! 하지만 우승을 위해선 단순한 요리 실력이 아닌 팬덤을 형성할 수 있는 무언가가 더 필요한데…. ""야, 내가 좋은 생각이 있는데. 비즈니스 게이 퍼포먼스라고…….""



정지호의 비게퍼 파트너 최우혁. 생긴 건 기럭지 최강 남신 모델급이지만 재수없고 양아치같이 생긴 X새끼에 인성은 파탄난 소시오패스고 말 한마디 할 때마다 주둥이를 팍 쳐서 싸물게 만들고 싶은 호로방탱이인데. 서로의 이익을 위해 그렇게 최우혁과 정지호는 비지니스 파트너가 된다.



많은 독자들의 사랑을 받은 만큼 단행본 출간을 기념해 가위 작가가 새롭게 그린 일러스트를 활요한 다양한 굿즈와 함께 구성한 리미티드 에디션도 발매하게 되었다. 굿즈는 독자들이 가장 좋아하는 아이템인 아크릴 스탠드 3종, 일러스트 럭스 카드 3종, 인생네컷 등으로 구성했다. 특히 아크릴 스탠드는 주인공 지호, 우혁과 더불어 서브 캐릭터인 종한까지도 모두 구성해 독자들의 기대가 클 것이다. 아크릴 스탠드와 더불어 모든 굿즈는 기존에 없던 새로운 일러스트로 제작해 소장 가치를 더욱 높였다."
6,자취 요리왕 1,https://search.shopping.naver.com/book/catalog/36409223619,https://shopping-phinf.pstatic.net/main_3640922/36409223619.20221227210016.jpg,가위,14850,뒹굴,20230125,9791164798612,"가진 거라곤 얄상한 얼굴과 고양이 현호밖에 없는 흙수저 대학생 정지호. 자취생의, 자취생에 의한, 자취생을 위한 요리 서바이벌 프로그램 〈자취요리왕〉에 참가하여 상금 5천만 원을 획득하기 위한 꿈에 부풀어 참가 신청서를 내고, 방송 무대까지 진출하게 된다! 하지만 우승을 위해선 단순한 요리 실력이 아닌 팬덤을 형성할 수 있는 무언가가 더 필요한데…. ""야, 내가 좋은 생각이 있는데. 비즈니스 게이 퍼포먼스라고…….""



정지호의 비게퍼 파트너 최우혁. 생긴 건 기럭지 최강 남신 모델급이지만 재수없고 양아치같이 생긴 X새끼에 인성은 파탄난 소시오패스고 말 한마디 할 때마다 주둥이를 팍 쳐서 싸물게 만들고 싶은 호로방탱이인데. 서로의 이익을 위해 그렇게 최우혁과 정지호는 비지니스 파트너가 된다.



많은 독자들의 사랑을 받은 만큼 단행본 출간을 기념해 가위 작가가 새롭게 그린 일러스트를 활요한 다양한 굿즈와 함께 구성한 리미티드 에디션도 발매하게 되었다. 굿즈는 독자들이 가장 좋아하는 아이템인 아크릴 스탠드 3종, 일러스트 럭스 카드 3종, 인생네컷 등으로 구성했다. 특히 아크릴 스탠드는 주인공 지호, 우혁과 더불어 서브 캐릭터인 종한까지도 모두 구성해 독자들의 기대가 클 것이다. 아크릴 스탠드와 더불어 모든 굿즈는 기존에 없던 새로운 일러스트로 제작해 소장 가치를 더욱 높였다."
7,하얀 자취 (김지희 산문집),https://search.shopping.naver.com/book/catalog/32506160803,https://shopping-phinf.pstatic.net/main_3250616/32506160803.20221229073816.jpg,김지희,12600,이가서,20150511,9788958643135,"일상의 희망을 섬세하게 묘사한 김지희 산문집. 안경과 치아교정기를 하고 웃고 있는 소녀 Sealed smile 시리즈로 유명한 김지희 작가. 국내와 해외에서 150여회의 전시를 가지며 꾸준히 글을 써 온 화가 김지희가 유려한 필치와 작가 특유의 섬세한 표현력으로 한 폭의 그림 같은 글을 책으로 엮었다. 



&lt;하얀 자취&gt;는 한 인간이 겪는 지극히 평범한 일상의 순간을 작가만의 시선으로 풀어낸 기록이다. 작가는 자연과 일상이 주는 보편성 안에서 가장 중요한 순간은 어제도 내일도 아닌 '오늘'임을 말한다. 타인의 시선에서 자유로워지는 용기, 비교에서 벗어나 스스로 행복해지는 법, 열정과 희망을 잃지 않는 길을 여행과 예술, 삶 주변의 소소한 대상을 통해 깨우친다. 특히 동양화의 5가지 색 이름인 선황, 지분, 백록, 양홍, 호분으로 나누어진 챕터에는 한 챕터를 아우르는 단편소설이 담겨있어 눈길을 끈다."
8,숨결 그 자취를 찾아서 (손수여 제5시집),https://search.shopping.naver.com/book/catalog/32489353950,https://shopping-phinf.pstatic.net/main_3248935/32489353950.20230920071811.jpg,손수여,9000,한글,20180925,9788970735542,"우주 안의 존재
그냥 생겨난 게 어찌 있으랴
숨결, 그 자취를 더듬어 간다

나 같은 나를 그리고 
시다운 시를 쓰고 싶다
한 편이라도 내 색깔의 시를

이 바람을 찾아
쉼 없이 다가서리라

아직은 너무나 먼
그 날을 만나기 위하여

 무술년 국추절에
 월촌재에서   손수여 쓰다."
9,"해밑섬, 일본을 걷다 (고대 한반도 이주민들의 장대한 자취를 찾아가는 역사기행)",https://search.shopping.naver.com/book/catalog/42372349625,https://shopping-phinf.pstatic.net/main_4237234/42372349625.20230912083603.jpg,이재일,15300,이서원,20230901,9791189174989,"한반도인의 일본 이주 고대사를 기행하다

‘해밑섬’이라함은 일본의 일(日)은 우리말 ‘해’이며 본(本)은 우리말 ‘밑’을 뜻하는 현재의 일본 열도를 뜻한다.
이 책은 기 원전 3세기경부터 시작하여 기원후 7세기까지의 약 1000년에 걸쳐 펼쳐졌던 한반도인들의 일본열도로의 장대한 이주의 자취를 찾아가는 역사기행이다.

저자는 도쿄에 살고 있던 어느날 도쿄평야에 남아있는 고구려 이주민들의 역사를 알게되고 놀라움을 금치 못한다. 저자가 그때까지 알지 못했고 배운 적도 없는 새로운 사실이었기 때문이다. 우리 선조들이 언제 어떻게 무슨 이유로 이곳까지 왔을까를 궁리하던 중 재일 역사가 김달수씨의 한반도 도래인에 관한 연구를 접하게 된다. 그의 책에는 고구려인 뿐만 아니라 도쿄평야의 북쪽에 남아있는 신라인과 가야인의 발자취에 대한 기록도 있었다.

도쿄평야에 남겨진 한반도 이주 집단의 역사를 알아보는 과정에서 시간을 두고 겹겹이 쌓여온 지층과 같은 한반도 이주민들의 역사를 알게되고 그들이 도쿄평야를 개척한 주역이었을 수도 있다는 생각이 들면서 그렇다면 과연 우리가 알고 있던 일본열도의 본토인이라는 일본인이란 누구인가에 대한 생각을 하게된다. 또한 이 고대의 한반도 이주민들이 시간이 지나면서 중세에는 어떻게 되었을까 하는 의문을 풀어보기 시작한다.

저자는 도쿄 지방을 시작으로 역사기행의 범위를 넓혀가며 한반도 선조들의 고대 이주의 역사가 남아있는 일본열도 내의 여러 현장을 방문하기 시작한다. 역사기행의 범위는 도쿄평야에서 일본열도의 본섬인 혼슈의 북쪽 해안으로 이어지고 세토내해 양안, 교토 주변, 오사카 남쪽의 가와치, 나라와 아스카 그리고 규슈 전역에 이르기까지 한반도 이주민들의 자취가 남아있는 일본열도 전지역에 걸쳤다.

저자는 기행과 더불어 한일고대사에 관한 기존의 모든 역사 가설들을 폭넓게 살펴보고 이 가설들 사이에 공통적인 부분을 발견한다. 확실한 것은 기원전부터 시작된 한반도로부터 일본열도로의 초기 이주, 이주의 주체에 대해서는 이견이 있지만 기원후 3~4세기에 일어난 강력한 한반도 세력의 일본열도 진출과 이를 전후한 집단 이주, 그리고 5~6세기에 나타난 백제계 세력의 일본열도에 대한 영향력 증대 등이다.

저자는 귀국 후 우리 고대국가들의 초기역사를 살펴보며 국내의 답사활동을 계속하였다. 일본열도에서 보고 알게된 것들과 우리 고대사와의 연관성을 확인하기 위해서였다.

이러한 역사기행의 기록과 한일고대사의 가설들을 3편의 책으로 정리하였고 이 책은 그 첫번째 편이다."
0,력사의 자취 (북한의 소설),https://search.shopping.naver.com/book/catalog/32496160998,https://shopping-phinf.pstatic.net/main_3249616/32496160998.20221019124534.jpg,김종회,79200,국학자료원,20120615,9788927901716,"「북한문학 연구자료총서」제3권『력사의 자취』. 남북한 문화통합과 한민족 문학의 연구를 목적으로 한 북한문학 연구총서이다. 제3권에서는 이기영의 , 최명익의 , 한설야의 , 이춘진의 , 이태준의 , , 윤세중의 , 김남천의 , 이북명의 ,  황건의 , 김형교의 , 권정웅의 , 조희건의 , 강복례의 , 한웅빈의  등을 담고 있다. 1945년 ‘평화적 민주건설 시기’부터 현재에 이르기까지 각 시기를 대표하는 북한 소설의 대표적 작품들을 모아 소설로 당시의 북한을 이해할 수 있다."
1,남명의 자취,https://search.shopping.naver.com/book/catalog/32496581619,https://shopping-phinf.pstatic.net/main_3249658/32496581619.20221229071331.jpg,이창호^김경수,18000,글로벌콘텐츠,20140820,9791185650555,"조선 중기 영남의 강우학파를 이끌었던 실천성리학자 남명 조식에 대한 완벽한 안내서이다. 책의 내용은, 남명이 거주했던 덕산 합천 김해에 남아 있는 그의 사적지에 대한 자세한 설명과 각 사적지에 걸려 있는 모든 종류의 현판, 그의 죽음 이후 그의 생애와 업적에 관한 일차적인 기록물인 행장·묘갈명·신도비명·묘지명, 생전에 임금이 내린 교지, 그가 남긴 유품, 그가 생전에 찾았던 명소에서 남긴 시 그리고 그의 부모와 부인 및 아들의 묘비명까지를 망라하여 번역문과 원문을 함께 수록하고 있다. 



따라서 이 책은 지금까지 없었던 새로운 개념의 답사자료집이자 역사 인물 연구의 지침서라고 할 수 있다. 또한 일반인부터 전문가에 이르기까지 누구나가 쉽게 읽고 이해할 수 있도록 최대한의 편의를 제공한 전문학술서이자 입문서로서의 역할을 동시에 할 수 있도록 구성되었다."
2,자취요리왕 리미티드 에디션 (아크릴 스탠드 3종 + 일러스트 럭스 카드 3종 + 인생네컷),https://search.shopping.naver.com/book/catalog/36410337625,https://shopping-phinf.pstatic.net/main_3641033/36410337625.20221229071839.jpg,가위,79200,해피북스투유,20230125,9791164798643,"*비게퍼: ‘비즈니스 게이 퍼포먼스’의 줄임말.

가진 거라곤 얄상한 얼굴과 고양이 현호(검을 현, 호랑이 호)밖에 없는 흙수저 대학생 정지호.
자취생의, 자취생에 의한, 자취생을 위한 요리 서바이벌 프로그램 〈자취요리왕〉에 참가하여 상금 5천만 원을 획득하기 위한 꿈에 부풀어 참가 신청서를 내고, 방송 무대까지 진출하게 된다!
하지만 우승을 위해선 단순한 요리 실력이 아닌 팬덤을 형성할 수 있는 무언가가 더 필요한데…….
""야, 내가 좋은 생각이 있는데. 비즈니스 게이 퍼포먼스라고…….""
""…….""
""너랑 내가 비게퍼를 하면…""
""…….""
정지호의 비게퍼 파트너 최우혁. 생긴 건 기럭지 최강 남신 모델급이지만 재수없고 양아치같이 생긴 X새끼에 인성은 파탄난 소시오패스고 말 한마디 할 때마다 주둥이를 팍 쳐서 싸물게 만들고 싶은 호로방탱이인데. 서로의 이익을 위해 그렇게 최우혁과 정지호는 비지니스 파트너가 된다."
3,나 없이 자취하지마라 (슬기로운 1인 가구 라이프),https://search.shopping.naver.com/book/catalog/32496892348,https://shopping-phinf.pstatic.net/main_3249689/32496892348.20231229070833.jpg,오정희^정단비,13500,뮤즈(MUSE),20211120,9791191677133,"자취 - (명사)손수 밥을 지어 먹으면서 생활하는 것.

이렇게 사전적 의미를 볼 때 자취는 사람이 살아가는데 있어서 가장 기본적인 행위이다. 

그러나 어떤가? 

이제는 200만 가구를 넘어버린 1인 가구, 즉 자취러들에게 있어 자취란 그리 쉬운 것이 아니다. 이제 13년차 자취 생활에 접어든 작가의 경우도 그러하다.

자취를 하며 누리는 독립은 무한한 자유를 안겨주지만 그만큼 홀로 모든 것을 책임져야한다. 힘겨운 하루 일과를 마치고 집에 들어오면 눈에 밟히는 쌓아놓은 설거지거리, 어질러진 빨래, 우체통을 초라하게 채운 고지서, 한 달 식비, 월세… 생각만 해도 눈앞이 아찔해지는 것들이다.
 
누구나 자취를 하면서 이런 생각 한 번쯤은 해봤을 것이다. 

“정말 이대로 괜찮은가?”
 
이에 대한 작가의 답은 ‘그렇지 않다’이다. 

드라마나 영화에서나 볼 수 있는 현실과는 동떨어진 판타스틱한 자취는 아니더라도 지금 나에게 주어진 이 환경을 스스로 컨트롤하고 헤쳐 나가고 싶다. 이러한 생각은 분명 작가뿐만 아니라 모든 자취러들이 가지고 있을 것이라 확신한다.

그래서 뮤즈출판사에서는 국내 최초 1인 가구 전문 미디어 '데일리팝'을 창간한 정단비 대표와 오정희 이사가 만든 슬기로운 1인 가구 라이프를 위한 지침서 『나 없이 자취하지 마라』를 펴냈다. 

이 책에는 혼족(혼자사는 사람들)을 위한 집구하기부터 살림노하우, 자취생을 위한 돈 관리 노하우, 청소와 요리 등 실 생활에 필요한 자취 꿀팁과 자취선배들의 에세이들을 한 권에 모두 정리했다.

자취를 시작하는 이들이라면 한 번쯤 챙겨봐야 할 지침서이자 생활백서가 되어줄 것이다."
4,사도 요한이 들려주는 주님의 자취 2,https://search.shopping.naver.com/book/catalog/32455354647,https://shopping-phinf.pstatic.net/main_3245535/32455354647.20231215070756.jpg,이재록,3600,우림,20130307,9788975576720,"『주님의 자취(두번째)』는 영적 믿음을 성장시키는 징검다리 교재이다. 예수님의 십자가 고난과 부활, 승천에 담긴 사랑의 섭리, 성령을 받아 권능의 증인이 되기를 당부하시는 주님의 마지막 메시지 등이 담겨 있다."
5,"이거 정말 맛있습니다 (맛있는 요리의 지름길, 치트키가 있다면 바로 유튜버 자취요리신)",https://search.shopping.naver.com/book/catalog/32473020226,https://shopping-phinf.pstatic.net/main_3247302/32473020226.20230912083450.jpg,자취요리신,19800,종이향기,20220430,9791191292527,"자취 요리 스페셜 리스트 121가지 심플 레시피!

박무땡이라는 예명으로 활동 중인 구독자 103만명의 유튜버 자취요리신의 요리 비법 레시피를 담은『이거 정말 맛있습니다』  거창한 재료가 아닌, 간단한 재료로도 근사한 한끼가 뚝딱 완성되는 121가지 심플쿡 레시피가 수록되어 있다. 요리를 전혀 못해도 한식부터 양식, 중식은 물론 디저트까지 뚝딱! 누구나 손쉽게 만들어 먹을 수 있는 자취 요리를 주로 다룬다.

스팸 숙주 볶음, 스팸가스, 크림만두, 순두부 라면, 두부 콩국수, 삼겹살 두부 김치, 된장 스팸 덮밥, 마파두부, 참치 마요 비빔밥, 떡만두국, 묵은지 등갈비 찜 등 간단한 재료로 근사한 요리를 5분 컷에 완성할 수 있다. 바쁘다 바빠 현대 사회의 자취생들에게 필요한 초초 간단 레시피를 만나보자."
6,[POD] 말자취,https://search.shopping.naver.com/book/catalog/32457423168,https://shopping-phinf.pstatic.net/main_3245742/32457423168.20221229072910.jpg,고성준,13500,글ego,20190708,9791196749637,"외부와 자신의 거리를 좁혀야 현재보다 수월한 미래가 존재하는 세상. 이 세상은 이를 재촉하고, 사이에 장애물을 놓기 위해 안달복달이다. 갈수록 바쁘고 치열해지는 현실에 적응하기 위해 자신과 내면의 거리는 벌어진다. 너무 멀어서 서로가 보이지 않으면 세상에 완벽하게 스며든 것일까. 궁극적인 근원이 어딘지도 모를 끊임없는 요구를 평생 맹목적으로 수행한다면, 어떤 결과가 우리를 기다릴까. 죽음이다. 인간에게 주어진 시간은 한정적이고, 자연은 그 시간 안에 인간을 흙 밑으로 끌어내릴 기회를 호시탐탐 노린다. 이에 더해 사회는 두 가지 선택을 할 수 있다. 땅에 빨려드는 인간을 붙잡거나, 그대로 쑤셔 박거나. 우리는 구원 받거나, 버림 받는 두 가지 선택지를 향하여 주 100시간 이상 공부하고, 주 50시간 이상 회사에 붙어있는 게 아니다. 각자의 기준에 부합하는 인간다운 삶을 살기 위해 시간과 에너지를 투자하는 것이다. 다만 그 결과물이 돈이라는 물질적 한계를 벗어나지 못한 경우가 대부분이기에 의미가 퇴색 된다. 무엇을 하기 위해 돈이 들지 않는다면 서슴없이 할 수 있는 것이 많다. 경비 없이 여행을 가거나, 강의료 없이 음악, 운동, 기술 등을 배울 수 있다면, 당장이라도 시도할 사람들이 많을 것이다. 지척에 놓인 먹고살 문제부터 해결해야 다음을 누릴 수 있다. 기본적인 한계가 생각보다 높기 때문에 개인과 내면은 영영 결합하지 못하고 끝나기도 한다. 하지만 이 사회 또한 인간이 만든 것이다. 바쁜 일상 속에서도 자아를 찾으려는 노력을 보았다. 10편의 노력이 묶여 하나의 책이 나왔다. 이런 행위가 점
차 사회 전체에 전염병처럼 퍼진다면, 그땐 노력이 아니라 일상이 될것이다.

- 라아팅리더 소설가 정성우"
