,title,link,image,author,discount,publisher,pubdate,isbn,description
7,주님의 자취(하) (이재록 목사의 요한복음강해),https://search.shopping.naver.com/book/catalog/32441781736,https://shopping-phinf.pstatic.net/main_3244178/32441781736.20230919123631.jpg,이재록,9000,우림,20090220,9788975571992,"| 표지 설명 |

예루살렘 입성과 십자가의 고난, 승천에 이르기까지 예수님의 자취가 묻어나는 성지 사진이 한 컷 한 컷 영화 필름처럼 흐르고 있다."
8,장호공실기 (병조 판서 조윤손의 삶의 자취),https://search.shopping.naver.com/book/catalog/32503506936,https://shopping-phinf.pstatic.net/main_3250350/32503506936.20221230073938.jpg,조규태,19800,한국문화사,20141030,9788968171741,"장호공의 후손인 저자가 직접 장호공의 행적을 알 수 있는 글들을 본격적으로 모아 엮은 책이다. 한국고전번역원에 있는 문집들을 검색하여 장호공에 관한 글들을 모두 추려내어 정리하였다. 그리고 조선왕조실록에 실려 있는 장호공과 관련된 글들을 다시 정리하며, 어려운 말들에 주석을 다는 작업을 하였다. 그리고는 이 글들과 비문, 그리고 박용국 교수가 쓴 장호공에 관한 논문을 자료로 하여 장호공의 연보를 엮었다.

이 책에 실린 글은 주로 장호공과 명홍정에 관한 글인데, 남들이 장호공에 관해 쓴 글들, 그리고 조선왕조실록에 실린 장호공과 관련된 가사들이다. 여기에 최근에 박용국 교수가 쓴 장호공에 관한 논문이 장호공을 체계적으로 이해할 수 있도록 실려 있다. 마지막으로 시랑공파 이야기가 더 보태어져 있다."
9,삶따라 자취따라 다산 정약용 (실학의 집대성지 다산초당),https://search.shopping.naver.com/book/catalog/33394359619,https://shopping-phinf.pstatic.net/main_3339435/33394359619.20230214162331.jpg,윤동환,16200,다산기념사업회,20180618,9791196879402,"“다산 정약용 선생을 알지 못하면, 근세 한국의 학문과 사상을 말할 수 없다.”
“술에 취하면 하루가 가고, 목민심서에 취하면 천년 대계가 이루어진다.”

그 동안 수많은 사람들이 다산문화원을 다녀갔습니다. 다산문화원에는 다산정신을 이해하고 실천하고자 하는 이들의 흔적이 이 시대 사람들의 발자취가 되어 이미 수백 권의 기록으로 남아 있습니다. 이 기록은“효도는 부모님의 뜻을 거스르지 않는 것이다. 동트기 전에 일어나라, 기록하기를 좋아하라.”고 당부하신 다산 말씀의 실천이기도 합니다.

이들은 강의를 듣고, 토론하고, 기록하면서 어른과 아이들이 함께 읽을 수 있는 책이 있었으면 좋겠다고 했습니다. 다산 초당을 다녀와서 자녀들과 함께 느낌을 정리하고, 다산의 정신을 쉽게 이해할 수 있는 책이면 더욱 좋겠다고 했습니다.
이 책은 이런 방문객들의 요청을 받아들여 쓴 책입니다.
다산선생의 어린 시절부터 오늘의 초당이 있기까지의 내용을 산문적으로 기술하여, 누구나 쉽게 접할 수 있도록 하였습니다. 다산초당을 답사하는 많은 분들의 다산 정약용 선생에 대한 지적(知的) 염원을 채워 줄 수 있을 것입니다.

평소 다산정신 생활화 운동을 추진해 왔던 저의 노력이  
삶 따라 자취 따라 다산 정약용」이라는 책으로 정리되어, 다산문화원에서 함께 토의하고 기록하면서 다짐하였던 많은 분들 외에도, 다산을 알고자 하는 더 많은 독자들과 만나게 되어 기쁩니다. 오늘을 살기 힘겨워 하는 많은 분들께 희망이 되고, 귀중한 깨달음으로 간직되길 바랍니다. 〈저자 서문에서〉"
0,세계의 박물관 (변화와 진화이 발자취),https://search.shopping.naver.com/book/catalog/32492749378,https://shopping-phinf.pstatic.net/main_3249274/32492749378.20221228073424.jpg,아트빌리지 편집부,92150,아트빌리지,20160218,9791159680076,▶ 이 책은 세계의 박물관을 다룬 이론서입니다. 세계의 박물관의 기초적이고  전반적인 내용을 학습할 수 있도록 구성했습니다.
1,동아시아의 부엌 (민속학이 드러낸 옛 부엌의 자취),https://search.shopping.naver.com/book/catalog/32490334733,https://shopping-phinf.pstatic.net/main_3249033/32490334733.20221019143451.jpg,김광언,66500,눌와,20150430,9788990620736,"[동아시아의 부엌]은 국립민속박물관장을 역임한 김광언 교수가 한·중·일 동북아시아 세 나라의 부엌에 대한 민속학 연구 성과를 엮은 것이다. 책은 화덕, 불씨, 부엌, 한데부엌, 조왕, 그릇, 솥, 숟가락과 젓가락, 박에 대한 자료가 어원을 시작으로 형태, 민속 그리고 그에 얽힌 속담까지 일목요연하게 정리되어 있다. 서로 닮았으면서도 다른 한국, 중국, 일본의 관계를 저자의 표현을 빌려 말하면 “중국은 뿌리, 한국은 둥치, 일본은 가지”이고, 세 나라의 문화는 “한 그루에서 피어난 꽃”이다."
2,묵자의 철학 (묵자의 삶의 자취와 활동 그리고 사상),https://search.shopping.naver.com/book/catalog/42073481665,https://shopping-phinf.pstatic.net/main_4207348/42073481665.20230913071615.jpg,정걸문^장천^민홍석,13500,일파소,20230825,9791198205131,"이 책은 ‘중국사상가평전(中國思想家評傳)’ 시리즈 중 한 권으로, 묵자, 공자, 노자 등 중국 역사상 뛰어난 사상가들을 일반인들에게 널리 소개해 쉽고 빠르게 읽을 수 있도록 편집된 책이다. 묵자사상의 핵심 내용만을 모아 놓았기 때문에 책의 분량이 많지 않고 그 내용도 간략한 ‘묵자 입문서’다. 
14개의 장으로 나뉘어 방대한 묵자사상을 하나도 빠트리지 않고 일일이 언급하고 있는 점이 이 책의 장점이다. 묵가의 경제, 윤리, 군사, 종교, 교육, 정치, 인식의 문제를 다루고 있으며, 다른 입문서에서 볼 수 없는 ‘묵경’에 관하여 상세한 서술이 돋보인다. 묵가의 흥망성쇠와 묵가의 영향까지 언급하고 있다. 묵자사상을 조망하는 데 조금도 손색이 없어 보인다."
3,프로이트의 두 발자취,https://search.shopping.naver.com/book/catalog/32496220790,https://shopping-phinf.pstatic.net/main_3249622/32496220790.20220521034503.jpg,지그문트 프로이트,0,하나의학사,19950901,5000155421,
4,백두대간의 자취소리 2 (김기태 산행기),https://search.shopping.naver.com/book/catalog/32443871796,https://shopping-phinf.pstatic.net/main_3244387/32443871796.20221019132620.jpg,김기태,13500,해드림출판사,20200110,9791156343882,김기태 속초 산행대장의 백두대간 두 번째 이야기다. 수년 동안 대원들과 함께 백두대간을 정기 산행하면서 겪은 희로애락을 담았다. 백두대간 자취소리1에 이어 두 번째 엮어낸 백두대간의 숨소리라 할 수 있다. 말이 산행이지 백두대간이 어디 그리 쉬운 길인가. 어쩌면 산행 그 자체보다 회원들을 이끌고 소통하며 무사히 산행을 마치는 일이 더 중요할 수 있다. 그러다 보니 산행에서 겪은 애환보다 서로를 향한 숨소리가 더 거칠기도 하다.
5,"공주의 숨과 향 (공주인들의 말과 생각, 삶의 자취)",https://search.shopping.naver.com/book/catalog/32504738850,https://shopping-phinf.pstatic.net/main_3250473/32504738850.20221229071138.jpg,조동길,21600,한국문화사,20150620,9788968172335,"공주라는 특정 지역사회를 문화적 관점에서 다룬 글들만 수록한 이 책의 내용은 세 부분으로 되어 있다. 역사, 문화적으로 유서가 깊은 공주에 대해서는 그 동안 백제문화 중심으로 학술적 연구가 집중되어 왔으나 이 책에서는 관심의 범위를 확장하여 공주의 말과 글, 산천, 인물과 정신에 대해 집중적으로 고찰하였다. 



시대적으로는 중세와 근현대 문화유산에 대해 초점을 맞추어 연구한 결과들이다. 공주의 한글연구회 활동, 공주출신 김인겸의 한시, '금행일기'와 '계룡산기'의 분석, '금란구곡' 고찰, '독락정기' 번역과 평설 등은 그 동안 어느 학자도 거론하지 않았던 것들이며, 아울러 공주에 관한 다각적인 칼럼들은 정책적 대안 제시와 함께 공주의 미래에 대한 깊은 성찰을 담고 있다."
6,프랑스식 자취 요리: 모쪼록 최선이었으면 하는 마음 (띵 시리즈 4),https://search.shopping.naver.com/book/catalog/32491371627,https://shopping-phinf.pstatic.net/main_3249137/32491371627.20230920071502.jpg,이재호,10080,세미콜론,20200909,9791190403771,"인생의 모든 ‘띵’ 하는 순간,
식탁 위에서 만나는 나만의 작은 세상

민음사 출판그룹의 만화ㆍ예술ㆍ라이프스타일 브랜드 ‘세미콜론’에서 새롭게 론칭하는 ‘띵’ 시리즈는 한마디로 ‘음식 에세이’이다. 앞으로 각 권마다 하나의 음식이나 식재료, 혹은 여러 음식을 하나로 아우르는 데 모두가 납득할 만한 주제를 가급적 선명하게 선정해나갈 계획이다. 이때 기본 원칙은 각자의 애정을 바탕으로 할 것. 우리는 좋아하는 것을 이야기할 때 더욱 할 말이 많아지고 마음이 분주해지니까. “내가 좋아하는 것을 함께 좋아하고 싶은 마음”을 캐치프레이즈 삼아 이 시리즈는 꾸려질 예정이다.
각 권마다 주제가 바뀐다는 점에서 잡지 같기도 하고, 한 사람(혹은 두 사람)의 에세이로 온전히 채워진다는 점에서 일반 단행본 같기도 한, 무크지의 경계선에 이 책들이 놓여도 좋겠다. 그러면서도 시리즈의 고정된 포맷 몇 가지를 제외하고는 제각기 자유로운 디자인과 내용 구성을 통해 작가의 개성을 충분히 담아내고자 하였다. 판형은 아담한 사이즈의 문고본 형태로 제작되었으며, 언제 어디서나 휴대가 용이해 부담 없이 일상에 자리하기를 바란다.
책의 모두(冒頭)에는 담당 편집자의 ‘Editor's Letter’를 싣는다. 이것은 잡지에서 흔히 볼 수 있는 형식이기도 하지만, 단행본에서는 새로운 시도가 될 것이다. 독자에게 건네고 싶은 ‘말 그대로’ 편지의 형태를 띠고 있으며, 비하인드 편집 스토리를 소개하거나 짧게나마 책을 안내하는 문장들로 채워질 예정이다. 이것은 편집자의 목소리를 통해 조금 더 가까이 독자와 소통하고 싶은 출판사의 마음이기도 하다."
7,부커상과 영소설의 자취 50년,https://search.shopping.naver.com/book/catalog/32492734286,https://shopping-phinf.pstatic.net/main_3249273/32492734286.20221230074910.jpg,박선화,28800,동인,20190810,9788955068092,▶ 이 책은 영미소설론을 다룬 이론서입니다. 영미소설론의 기초적이고 전반적인 내용을 학습할 수 있습니다.
8,고독한 직장인의 자취 요리기 ((feat) 1평 좁은 주방),https://search.shopping.naver.com/book/catalog/38783387624,https://shopping-phinf.pstatic.net/main_3878338/38783387624.20230829091550.jpg,한태희,18900,지콜론북,20230324,9791191059397,"퇴근 후, 고독한 식사로 하루를 마무리하는 당신에게
“다 먹고 살자고 하는 일이잖아요”

오랫동안 요리 연구가로 근무한 저자가 직장인의 고독함을 음식으로 위로한다. 지루한 일상 속에서 밥이라도 즐겁게 먹고 싶은 사람을 위한 레시피북이다. 어제 배달을 시켜 먹고 남은 음식으로, 오늘 마트에 들러 호기심에 구입한 소스로, 근처 재래시장에서 구입한 제철 식재료로. 어떤 재료든 『고독한 직장인의 자취 요리기』와 만나면 나를 충전하는 한 끼가 된다. 저자가 섬세하게 고민하며 당신에게 치유되는 레시피와 이야기를 건넨다.
 
서툰 솜씨도 구체적인 레시피만 있으면 일류 요리사가 된다. 저자는 요리가 익숙하지 않은 초보 요리사를 위한 팁을 다양하게 수록했다. 또한, 숟가락과 종이컵을 활용하여 손쉽게 계량할 수 있도록 레시피를 작성했다. 
  
레시피마다 저자의 짧은 에세이도 첨부했다. 요리하는 중간에 읽으면 ‘함께 만드는 요리’라는 생각이 든다. 나의 좁은 주방과 다르지 않은, 요리 연구가의 친근한 1평짜리 주방에서 이루어지는 마법 같은 ‘집밥 레시피’를 공개한다."
9,"비건 자취요리 노트 (스프링) (건강한 나를 위해, 지구를 위해)",https://search.shopping.naver.com/book/catalog/32439060077,https://shopping-phinf.pstatic.net/main_3243906/32439060077.20221228072218.jpg,권채아,14400,맛있는책방,20210428,9791196978792,"트위터 20,000 팔로워! 자칭 타칭 자취요리미식가 권채아의 비건자취요리

작년 한 해, 트위터를 뜨겁게 달구었던 포스팅이 하나 있었습니다. 바로 “국내외 자취 4년차, 지금까지 한 번도 배달 안 시켜 본 사람이 알려주는 잘 먹고 잘 사는 Tip” 이란 제목으로 올라온 비건자취요리 레시피였습니다. 해당 포스팅은 14000건이 넘게 리트윗이 되었고, 월 20만원도 안 되는 식비로 자취 요리 그것도 비건식을 야무지게 해먹는 자취요리미식가(자요미)의 요리에 많은 분들이 열광을 했습니다. 

20대 대학생, 사회 초년생들을 위한 맞춤 레시피 노트 
코로나로 인해 밀키트, 배달음식, 다양한 인스턴트 음식이 어마어마하게 발달하면서 집에서 음식을 해먹는다는 건 사실 쉽지 않은 일이 되어버렸죠. 하지만 저자는 이렇게 얘기합니다. 매일 하루 세 끼를 꼬박 해먹기보다 하루 한 끼, 아니면 이틀에 한 끼라도 나를 위한 밥상, 지구를 위한 밥상을 차려보자고 말이죠. 그래서 이 책에는 총 40가지 메뉴가 등장합니다. 후다닥 차릴 수 있는 아침 밥상부터 도시락으로 편하게 갖고 다닐 수 있는 점심, 가끔 친구들을 초대해 근사한 브런치를 대접할 수 있도록 했고 외식이 아니어도 충분히 만들 수 있는 마라샹궈, 밀푀유나베, 떡볶이 등 바깥 음식들을 건강한 비건식으로 즐기기 위한 아이디어가 가득합니다. 산뜻한 달달함을 채워줄 디저트 메뉴도 잊지 않았죠! 이 모든 것들이 다 비건 메뉴로요!"
0,"충무공 이순신 (삶, 시대 그리고 그의 자취)",https://search.shopping.naver.com/book/catalog/32493367827,https://shopping-phinf.pstatic.net/main_3249336/32493367827.20220527031118.jpg,김대현,0,예맥출판사,20140829,9788988502860,"『충무공 이순신』은 이순신과 관련된 유물과 유적, 사료를 깊이 있게 들여다본 책이다. 저자는 이순신을 하늘에서 기적처럼 나온 인물이 아니라 그 시대 성숙한 역사와 제도와 문화의 자양분을 누구보다 잘 흡수하여 체화시킨 인물이라고 말한다. 이순신을 멋지게 치장하기보다는 그 인물의 삶을 함께 걷도록 안내한다."
1,"청춘 자취요리백서 : 밥해먹자 (해마다 늘어나는 1인가구, 자취인들에게 꼭 필요한 요리 가이드!)",https://search.shopping.naver.com/book/catalog/32441031143,https://shopping-phinf.pstatic.net/main_3244103/32441031143.20221227210222.jpg,비티타임즈 편집부,27000,비티타임즈,20180806,9791163450023,"혼자 먹는다고 아무렇게나 먹지 말자
건강하고 맛있게 누구보다 더 잘 챙겨먹는 혼밥 레시피 

‘1인가구들의 건강한 식생활’을 위해 최대한 건강하면서도 간단하게 할 수 있는 요리들을 소개한다. 아침을 자주 거르는 습관부터 바로 잡기 위한, ‘아침대용식’ 부터 시작하여 대표적인 한식 반찬과 국 메뉴, 설거지 부담을 줄이기 위한 ‘한 그릇 음식’, 간편하면서도 건강한 ‘다이어트식’, 자취인도 가끔 특별하게 즐길 수 있는 간식과 브런치 메뉴, 음료, 마지막으로 한 번 해두면 유용하게 쓰일 드레싱·양념까지 수록하였다."
2,성경이 남겨놓은 자취를 찾아서 (성경이 남겨놓은 자취를 찾아),https://search.shopping.naver.com/book/catalog/39651707623,https://shopping-phinf.pstatic.net/main_3965170/39651707623.20230427143450.jpg,송근원,32500,부크크(bookk),20230420,9791141024109,"드디어 코비드 19가 끝나간다.
3년 동안의 팬데믹 상황이 이제 막바지에 이르러 마스크도 벗고, 외국 여행도 길이 트였다.
그 전부터 계획했던 이스라엘 요르단 성지 여행을 떠난다. 7박 9일의 여행이다. 집사람이 다니는 교회의 셀 모임에서 가자고 하여 무작정 따라나선 것이다.
이번 여행은 성경에 나오는 곳곳을 찾아가는 여행이다.
혹자는 이를 일러 성지순례 여행이라 한다.
독실한 기독교 신자들에겐 이 말이 전혀 틀린 말이 아니겠으나, 나 같은 꼰대에게는 성지순례보다는 그저 가이드의 성경 해설을 곁들인 설명과 함께 성지(聖地)를 기웃거리는 여행이었다.
옛날에 그러니까 16년 전이든가, 터키에 교환 교수로 나가 있을 때, 터키는 물론 시리아, 요르단 이집트를 여행한 적이 있었다.
이때의 여행도 대부분 로마 유적과 기독교 유적을 답사하는 일종의 성지순례 여행이었다.
그 당시 요르단에서 이스라엘을 들어가려 하였으나, 이스라엘에서 요르단으로 나오는 것은 되지만 아랍국가에서 이스라엘로 입국하는 것은 허락이 안 되는 시기였기에, 요르단의 아카바 항구에서 배를 타고 이집트의 시나이 반도로 건너갔던 기억이 있다.
따라서 이스라엘은 여행을 못하였는데, 이번에 그 기회가 온 것이다. 곧, 집사람이 나가는 교회의 셀 모임에서 이스라엘과 요르단의 페트라와 와디 럼을 끼어 넣은 패키지여행을 가자고 하여 그냥 조인하게 된 것이다.
페트라와 와디 럼은 옛날에 샅샅이 훑어본 바 있어 사실은 이를 빼고 이스라엘만 좀 더 속속들이 가 봤으면 했지만, 페트라와 와디 럼은 언제보아도 좋은 곳이기에 다시 한 번 더 보고 싶은 마음이 없지도 않았고, 같이 가신 분들이 너무나 좋은 분들이어서 이 여행을 선택하게 된 것이다.
사실 여행에서 우리가 찾는 것은 경치가 좋다든가. 역사적 의미가 있다든가, 학술적 흥미가 있다든가 등등 여러 가지가 있을 수 있으나, 그 어떤 여행도 함께 하는 분들이 좋아야 함은 말할 나위도 없다.
물론 패키지여행이어서 충남 서천 산너울 마을의 판교교회에서 오신 분들을 비롯하여 모두 38명이 일행이었는데, 나만 빼고 모두 독실한 분들이어서 큰 불편 없이 여행할 수 있어 참으로 좋았다.
그렇지만 이번 여행은 성지순례 여행인 까닭에 성경에 관해 알면 알수록 많이 보이는 여행이었고, 발품을 많이 파는 여행이었다.
성경은 옛날 옛날 아주 먼 옛날에 한 번 읽어본 적이 있으나, 주로 이스라엘 역사서, 그것도 지저분한 히브리인들의 역사라는 느낌 때문에 그 후에 다시 읽지 않았다. 그래서 큰 사건은 대충 기억이 나지만, 대부분 잊어버렸고, 자세히는 잘 모른다.
그러니 결과적으로 나에게는 주마간산 식으로 이곳저곳을 훑어보는 여행이었지만, 가이드인 두 분 목사님이 가는 곳마다 설명을 잘 해주셔서 어느 정도 충실하게 여행을 할 수 있었다.
이 자리를 빌려 두 분 목사님께 감사를 전한다.
그렇지만 짧은 기일에 많은 곳을 다니는 바람에, 들을 때 뿐 나중에 기록하려니 요기가 조기 같고, 저기가 여기 같고, 설명은 분명 들었는데······, 혼동이 된다.
결국 여행이 끝난 후, 뒤늦게 인터넷을 뒤져가며 열심히 성경 공부를 한 후, 쓰게 된 여행기가 이 책이다.
이번 여행에서 경치는 별로 중요한 것이 아니다.
물론 페트라와 와디 럼은 예외이긴 하지만, 다른 곳들은 그렇게 (경치로) 감명 깊은 곳은 아니다.
다만 성경을 바탕으로 그 자리에 그러한 역사적 사실이 있었다는 것, 그것만으로도 충분히 의미 있는 여행이었다.
사실 여행에선 볼거리도, 먹거리도, 즐길거리도 좋아야 하지만, 무엇보다도 이야깃거리가 좋아야 하는데, 이 여행은 이야깃거리만큼은 충분하다 못해 넘친다.
성경에 기록된 사실을 이야깃거리로 삼아 여행객들에게 제시할 수 있다는 점에서 이 패키지여행은 스토리텔링이 무궁무진한 복 받은 관광 상품이라 할 수 있지만, 대부분의 이야깃거리가 사실에 기반을 두기보다는 견강부회 식으로 끌어다 붙인 경우도 많다는 느낌을 종종 받았다.
물론 여행하면서 재미있게 그냥 받아들일 수는 있을 것이다. 그리고 그것도 나쁜 것은 아니다. 여행하며 스스로 즐기면 되는 것이기에!
그렇지만 중요한 것은 그 이야깃거리가 사실과 부합되느냐를 따지기 이전에, 그 속에 숨겨져 있는 진실과 본질을 보고 느끼면 더 말할 나위없는 좋은 여행이 될 것이다.
이 책이 이스라엘과 요르단을 여행하시는 분들, 특히 성지순례 여행을 준비하시는 분들에게 큰 도움이 되었으면 좋겠다."
3,"공간에 담긴 역사, 전통 건축의 자취",https://search.shopping.naver.com/book/catalog/32503910731,https://shopping-phinf.pstatic.net/main_3250391/32503910731.20221019145524.jpg,아치앤북 편집부,85500,아치앤북,20210228,9791159682117,"▶ 이 책은 공간에 담긴 역사, 전통 건축의 자취에 대해 다룬 도서입니다. 공간에 담긴 역사, 전통 건축의 자취에 대한 기초적이고 전반적인 내용을 확인할 수 있도록 구성했습니다."
4,몽중여시아문 4: 흔적도 자취도 없는 행을 위하여 (흔적도 자취도 없는 행을 위하여),https://search.shopping.naver.com/book/catalog/32436148158,https://shopping-phinf.pstatic.net/main_3243614/32436148158.20221019145319.jpg,우인,15300,유마북,20161221,9791185049199,『꿈에서 나는 이와 같이 들었다』를 재구성했다. 독자들로 하여금 법화문에 관심이 생길 수 있도록 일상생활과 밀접한 이야기를 들려준다. 일상과 불교가 자연스럽게 연결되면서 불교 자체에 대한 흥미가 높아진다.
5,큰 발자취를 남긴 세계의 여객선,https://search.shopping.naver.com/book/catalog/32456304697,https://shopping-phinf.pstatic.net/main_3245630/32456304697.20221228074651.jpg,한창용^이한석,17820,그린,20180130,9788957272626,▶ 이 책은 큰 발자취를 남긴 세계의 여객선에 대해 다룬 도서입니다. 항만공학의 기초적이고 전반적인 내용을 확인할 수 있도록 구성했습니다.
