,title,link,image,author,discount,publisher,pubdate,isbn,description
6,호남의 상흔·자취 그리고 기억 (강 건너 재 넘어 그곳에는 1),https://search.shopping.naver.com/book/catalog/33535783628,https://shopping-phinf.pstatic.net/main_3353578/33535783628.20220717015242.jpg,퉁소농부 정혁기,20000,부크크(bookk),20220701,9791137287259,"이 책에 실린 글들은 전라도 동남부 산간지역과 고을을 돌아다니며 느낀 글들이다. 산과 고개, 팍팍하고 인적 드문 마을을 돌며 만나는 얘기들이다. 나는 전라도가 산간지역이라고 말한다. 다른 지역에 비해 상대적으로 들이 많을 뿐이다. 전라도 역시 산의 고장이다. 들이 많다는 것이 틀린 얘기가 아니지만 그것은 어디까지나 다른 지역에 비해 상대적으로 그렇다. 전라도의 지도를 펴놓고 보면 잘 알 수 있다. 전라도와 경상도의 경계를 이루는 백두대간과 지리산 인근은 말할 것도 없고 중부지역, 나아가 서부지역을 넘어 남‧서해에 점점이 박힌 섬까지 백두대간에서 시작된 산경들이 전라도를 누비고 있다. 

  ​산은 우리 민족의 정신과 마음의 고향이다. 전라도의 산간을 알아야 하는 데에는 보다 근본적이고 중요한 이유가 또 있다. 바로 우리가 사는 땅에서 이루어지는 생활과 문화가 산의 흐름과 함께 해왔기 때문이다. 물길&#40;水經&#41;이 산의 흐름&#40;山經&#41;에 의해 결정되는 이치처럼 산과 물의 흐름&#40;山水經&#41;을 모르고서 국토를 이해할 수 없다. 백두대간을 알고 호남정맥을 알아야 한다. 금강을 알고 섬진강의 흐름을 알아야 한다. 나는 이를 ‘산수경답사법’이라 부른다. 인간은 산에서 시작해 들로 나갔다. 개활지인 들에서 인간이 살 수 있기까지에는 많은 시간과 자신감이 필요했다. 산은 험한 지형에 의지해 세력이 약해도 외부의 공격을 막아내며 모여 살 수 있었고 위기에 처했을 때는 산에 의지했다. 산에는 자신을 지켜주는 산신이 거주하고 있다고 믿었으며, 절에는 산신각을 지어 공동체와 마을, 가족의 발전과 안녕을 빌었다.

  그러나 한국사회에서 산이 많은 지역은 낙후된 지역을 뜻한다. 저개발 지역이며 조건 불리지역이다. 문화가 사람들이 모여 살면서 형성되고 전해지는 정신적·물적 가치의 총체라고 한다면, 축적된 문화의 양도 사람이 모여 사는 평지가 압도적일 것은 당연하다. 산에는 사람이 적게 살기 때문이다. 그러나 문화의 양이 산간지역에 적다고 해서 그 가치조차 적은 것이 아니다. 산에는 원형이 존재하기 때문이다. 답사를 산간지역부터 시작해야 하는 산수경 답사의 이유다.

  실린 글들은 전라도의 동남부 산간지역을 호남정맥과 물의 흐름을 따라 순회하며 전라도의 풍광과 문화, 역사를 소개하면서 또 다른 질문의 답을 구하려는 목적도 담겨있다. 답사를 통해 전라도를 이해해 보려는 것이다. 


  책의 구성은 여행의 순로를 따라 나누었다. 그리고 맨 마지막에는 부록을 모았다. 부록은 산수경 답사에 관한 글들인데 앞에 넣을까 생각다가 뒤로 보냈다. 기행서의 앞부분에 딱딱한 글들을 배치하는 것이 좋을 것이 없을 것 같았다. 먼저 읽어도 좋을 것이다.
  어느 누구는 싫증이 나기도 하련만 지금도 기회가 되면 전라도를 돌아다닌다. 대체 그곳이 어떤 곳이기에 아직도 마음의 끈을 끊지 못한단 말인가. 그럴 만한 가치가 있는 곳인가. 전라도를 찾아가는 여행은 길다. 다가가고 표현하는 일 역시 만만한 일이 아니다. 지방마다 켜켜이 쌓인 문화적, 역사적 삶의 층과 궤적이 깊고, 길고, 질기기 때문이다.
  이제! 호남, 전라도로 떠날 시간이다. 어느 길로 들어갈 것인가? 서해를 연안에 낀, 갯내음이 물씬 나는 서해안 길을 탈 것인가? 금강, 만경강을 건너고 들을 가로지르며 갈재를 넘는 1번 국도를 탈 것인가? 지리산을 감돌면서 지리산 휴게소에서 상긋한 눈의 휴식을 즐길 수 있는 88고속도로는 어떤가? 금산의 배티고개를 넘고 논산의 황산벌을 지나 들어갈 것인가? 그도 아니면 호남정맥이 자맥질하며 빠져드는 섬진강이 바다를 만나는 곳 섬진대교를 넘을 것인가?"
7,다산의 후반생 (다산 정약용 유배와 노년의 자취를 찾아서),https://search.shopping.naver.com/book/catalog/32485046116,https://shopping-phinf.pstatic.net/main_3248504/32485046116.20221019150854.jpg,차벽,18000,돌베개,20101004,9788971994115,"치열했던 다산의 후반생 36년을 따라가다!

조선 후기의 실학자 다산 정약용의 후반기 삶을 다룬 책『다산의 후반생』. 정조 치하에서 승승장구하던 다산의 운명은 정조의 갑작스런 죽음과 함께 바뀌었다. 1801년 11월, 유배의 길에 오르게 된 다산은 이후 18년이라는 긴 시간을 유배 생활로 채워야 했다. 하지만 다산은 유배지에서도 많은 제자와 지인을 두었고, 600여 권에 달하는 저서를 펴냈다. 프로 사진작가인 저자 차벽은 전라도 강진과 경기도 마재에서 다산이 걸었던 길을 함께 걷고, 그 길을 카메라 렌즈에 담아냈다. 다산의 치열한 삶, 너무나 인간적인 다산의 면모, 다산의 곁에서 묵묵히 그를 지켜준 사람들의 열기를 고스란히 전해준다."
8,대한민국 20대 자취의 달인 (반지하와 옥탑방에서도 잘살기),https://search.shopping.naver.com/book/catalog/32455038949,https://shopping-phinf.pstatic.net/main_3245503/32455038949.20220803184142.jpg,김귀현,0,에쎄,20090907,9788993905069,"20대, 화려한 독립을 꿈꾸지만 현실은 아늑한? 반지하와 옥탑방…….
돈 없고 빽 없는 20대가 가장 많이 거주하는 반지하와 옥탑 관찰보고서!

20대 반지하남과 옥탑녀가 전하는 자취이야기『대한민국 20대 자취의 달인』. 잘 다니던 회사를 그만 두고 카메라 하나 달랑 들고 해외로 떠나는 화려한 여행, 과연 이 로망을 이루고 살아가는 20대가 몇이나 될까? 이 책은 88만원 세대로 불리며 정글 같은 하루를 헤치고 살아가는 20대 자취생들의 이야기를 두 명의 저자가 자신의 경험을 바탕으로 생생하게 전한다. 또 Tip으로 자취생들이 알아둬야 할 기본 상식과 실용정보를 수록했다.

반지하님 김귀현은 자취를 하게 되면서, 절대로 다른 이들처럼 빨지 않은 옷을 계속 입는 짓만은 하지 않겠다고 결심한다. 빨래는 열심히 했지만, 아무리 빨아서 말려도 묘한 냄새가 나는 옷들 때문에 그는 임시방편으로 의류 냄새제거제를 한다. 하지만 곧 냄새제거제의 냄새까지 섞인 말로 형용할 수 없는 냄새로 인해 그는 ‘빨래’를 포기하고, 다른 자취남들처럼 한번 입은 옷 또 입기의 생활에 들어선다.

이 책은 총 3부로 구성되어있다. 1부에서는 반지하남 김귀현의 흥미진진한 사생활이 소개된다. 2부는 작가지망생 옥탑녀 이유하의 이중생활을 생생하게 전한다. 마지막으로 3부는 제3지대로 분류되는 곳에 살고 있는 주거민들의 ‘취중방담’과 자취생활에 유용한 팁을 수록했다. ‘억’ 소리 나도록 놀라운 전세에 겨우 살 곳을 정하고, 미덥지 못한 자취 환경 속에서도 하루하루를 유쾌하게 풀어가는 그들의 비하인드 스토리를 만나보자."
9,자취로운 생활 베스트 에피소드 1 (신개념 방구석 서바이벌 자취툰),https://search.shopping.naver.com/book/catalog/32436254135,https://shopping-phinf.pstatic.net/main_3243625/32436254135.20221019131447.jpg,안가연,13500,황금부엉이,20200909,9788960305625,"별점 9.9! 네이버웹툰 독자들의 넘치는 사랑을 받았던 자취툰이 돌아왔다!
당신의 자취 로망을 탈탈 털어줄 ‘짠한 우리 새끼’ 츄카피 작가의 웹툰 데뷔작

개그맨, 만화가, 유튜버 등 프로N잡러로 활동 중인 츄카피 작가의 웹툰 데뷔작이 단행본으로 출간됐다. 이 책은 〈자취로운 생활 베스트 에피소드〉 시리즈의 첫 권으로, 작가가 직접 고른 연재 초·중반에 해당하는 32화의 에피소드와 보너스 4컷 만화를 수록했다. 원룸에서 자취하던 초보자취러 츄카피의 모습과 귀여운 조카 뀨야를 담아낸 표지는 〈자취로운 생활〉의 팬이라면 탐이 날 수밖에 없을 것이다.
작가는 귀엽고 아기자기한 그림체로 본인은 극히 평범하다고 주장하는 범상치 않은 일상을 리얼하게 그려낸다. 원룸을 구해 이사하고 이제 막 자취를 시작하던 시기의 연재분이라 날것의 느낌이 생생하다. 네이버웹툰 독자들을 프로참견러이자 응원러로 만든 것이 바로 이런 짠함과 부족함(?) 때문이 아닐까. 
때로는 짠내 나지만 자취생이라면 누구나 한번쯤 겪어봤을 법한 에피소드들은 공감하기 충분하고, 그에 더해 곳곳에 드러나는 작가 특유의 유머는 시종일관 미소를 짓게 한다. ‘직장 동료’라고 불리는 개그맨 동료들도 존재감을 뿜어내며 작품에 활력을 불어넣는다. 또한 단행본 한정으로 웹툰 연재 때 독자들의 낙서 욕구를 자극했던 〈자취로운 생활〉 표지를 제공하여 교과서 표지에 낙서하고 꾸미던 학창 시절의 추억을 느낄 수 있도록 했다."
0,자취로운 생활 베스트 에피소드 2 (신개념 방구석 서바이벌 자취툰),https://search.shopping.naver.com/book/catalog/32497849003,https://shopping-phinf.pstatic.net/main_3249784/32497849003.20221019124616.jpg,안가연,13500,황금부엉이,20200909,9788960305632,"평점 9.9! 네이버웹툰 독자들의 넘치는 사랑을 받았던 자취툰이 돌아왔다!
당신의 자취 로망을 탈탈 털어줄 ‘짠한 우리 새끼’ 츄카피 작가의 웹툰 데뷔작

개그맨, 만화가, 유튜버 등 프로N잡러로 활동 중인 츄카피 작가의 웹툰 데뷔작이 단행본으로 출간됐다. 이 책은 〈자취로운 생활 베스트 에피소드〉 시리즈의 두 번째 권으로, 작가가 직접 고른 연재 중·후반에 해당하는 32화의 에피소드와 후기 4컷 만화를 수록했다. 이에 더해 반려묘 라인이가 등장하는 표지 그림을 통해 1권과 연결해 시간의 흐름도 느낄 수 있어서 독자의 팬들의 소장욕구를 자극한다.
작가는 귀엽고 아기자기한 그림체로 본인은 극히 평범하다고 주장하는 범상치 않은 일상을 리얼하게 그려낸다. 연재 중·후반에 이르면서 집주인과의 트러블, 이사, 안전 등 좀 더 무거운 소재를 다루면서도 특유의 긍정적인 유머를 잃지 않는 각 에피소드들은 자취를 꿈꾸는 사람은 물론, 자취를 하고 있는 사람들에게서 공감과 안타까움을 끌어낸다. 귀여운 조카 ‘뀨야’와 ‘직장 동료’들의 존재감도 여전하며 작품의 매력을 더한다. 
또한 웹툰 연재 때 독자들의 낙서 욕구를 자극했던 〈자취로운 생활〉 표지를 단행본 한정으로 제공하여 나만의 표지 꾸미기가 가능하다."
1,청언백년 淸言百年 (‘3부자 記者’ 100년의 글자취),https://search.shopping.naver.com/book/catalog/32485026853,https://shopping-phinf.pstatic.net/main_3248502/32485026853.20221229072727.jpg,박규덕^박종권^박종률,27000,인문서원,20180228,9791186542477,"아버지와 두 아들의 기자 생활 100년을 기념해 박규덕(1935~1998) 전 전북일보 주필, 박종권 전 중앙일보 논설위원, 박종률 CBS 논설실장 3부자가 직접 쓴 칼럼과 논평을 발췌해 엮었다. 이 책에는 같은 언론인이면서도 다른 지향을 가진 3부자 기자가 독특한 시선으로 1970년대부터 지금에 이르는 동안의 중요한 사건과 이슈들을 해석한 글을 접할 수 있다. 3부자는 모두 ‘기자’로 출발해 ‘논설위원’을 거쳤고, 언론인으로 입문한 신문사나 방송사를 단 한 번도 옮긴 적이 없다는 공통점을 가졌다. 특히 ‘3부자 기자’는 국내 언론계에 흔하지 않은데다 3부자가 언론인으로 활동한 기간이 100년을 넘은 것도 눈길을 끈다.



언론인의 길을 함께 걸었던 ‘3부자 기자’에게는 올곧은 저널리즘이 관통한다. 故 박규덕 씨는 전두환 군사정권 시절 군(軍)을 가시가 많아 울타리가 제격인 탱자나무에 비유하며 군의 정치 개입을 비판하다 중앙정보부에 끌려가 고초를 당했다. 큰 아들인 박종권 씨는 중앙일보 노동조합 발기인과 전임을 거쳐 한국기자협회 수석부회장으로서 공정언론을 구현하는 데 노력했고, 작은 아들인 박종률 씨는 한국기자협회 초대 직선 회장에 당선된 뒤 연임하며 저널리즘 복원에 힘썼다."
2,꿀키의 밥상 (자취왕 꿀키의 생존 요리 129선),https://search.shopping.naver.com/book/catalog/32504350350,https://shopping-phinf.pstatic.net/main_3250435/32504350350.20221228073134.jpg,이상희,10800,이밥차,20160502,9791195624003,"50만 명이 공감한 요리 1세대 유투버 꿀키, 이상희의 책. 이 책은 요리 초보 주방에서도 손쉽게 만들 수 있는 조리법과 실용적인 레시피로 가득하다. 특히, 꿀키의 레시피로 그럴듯한 한그릇 요리가 되는 시판 제품 요리도 눈여겨 볼만 하다. 또한 책 속에 담긴 레시피들은 하나같이 그 자체가 꿀팁이다.



'Part 1. 꿀키가 알려주는 요리 꿀팁'에서는 양념 고르기부터 알아두면 편한 요리의 잡기술, 요리 살림법 등 꿀키가 경험하고 터득한 꿀팁들을 세세히 담았고, 'Part 2. 재료 탐닉_ 재료 하나로 다양한 요리해 먹기'에서는 가장 만만한 식재료들을 골라 질리지 않고 남김없이 맛있게 먹을 수 있는 다양한 레시피들을 모았다. 'Part 3. 일타이피 _남은 요리로 다른 요리 해먹기'에서는 남은 음식, 재료를 색다른 메뉴 요리해 2배로 즐거운 꿀키만의 레시피를 소개하고, 'Part 4. 일품요리 _ 돈 없을 때 집에서 해먹기'에서는 돈이 없을 때, 혹은 함께할 친구가 없을 때, 집에서도 맛있게 해먹을 수 있는 요리 레시피를 담아냈다."
3,조선역사 천자문: 동악산 항일독립운동의 자취 (일제가 시도한 역사왜곡 교과서),https://search.shopping.naver.com/book/catalog/32486399626,https://shopping-phinf.pstatic.net/main_3248639/32486399626.20230425164302.jpg,박혜범,9000,이담북스,20101101,9788926816202,"일제가 시도한 역사왜곡 교과서『조선역사 천자문: 동악산 항일독립운동의 자취』. 비밀독립군의 일원이었던 경와 선생님이 전한 동악산본의 조선역사 천자문을 1895년 간행한 최초의 한국사 교과서 와 일제가 친일파 심형진을 내세워 왜곡해 만든 과 대조하면서, 우리 역사를 어떻게 말살했는지를 밝힌 책이다."
4,열정의 자취 적도 에콰도르에서 (코이카 중장기자문단 국가 프로젝트),https://search.shopping.naver.com/book/catalog/32496301767,https://shopping-phinf.pstatic.net/main_3249630/32496301767.20221227205947.jpg,우충환,0,시나리오친구들,20131209,9788989538493,"한국국제협력단(KOICA) 중장기자문단의 첫 출간물. KOICA는 2010년부터 중장기자문단을 개도국에 파견하여 국내 퇴직인력의 해외 진출을 활성화하고 해당 분야의 지식과 경험을 전수함으로써 개도국의 경제 사회 발전에 기여하고 있다. 이 책은 에콰도르에서 야차이 국립대학 설립 자문관으로 교육 발전 및 문화교류에 힘쓰고 있는 자문관의 현장 활동담이 생생하게 실려 있는 첫 출간물이다. 



중장기자문관의 활동 경험을 자세하게 담아 KOICA 봉사단원이나 중장기자문관의 해외봉사활동에 관심 있는 독자들에게 큰 도움이 되고자 하였다. 현지 활동 상황을 소상하게 다루었고, 현지 직원들과의 애환과 현지 생활의 적응, 대인 의사소통을 증진하기 위한 내용까지 싣고 있다."
5,간단하고 유용한 자취요리 20선,https://search.shopping.naver.com/book/catalog/45969893620,https://shopping-phinf.pstatic.net/main_4596989/45969893620.20240223054155.jpg,안소진,6900,퍼플,20191108,9788924065695,자취경력 10년차의 온라인판매를 하는 30대 중반 여성입니다.그 동안에 자취하면서 만들어 먹었던 것들을 올렸습니다.많은 도움이 되시길 바라겠습니다.
6,호모 자취엔스 (때론 외롭지만 혼자에 최적화된 1인 가구의 리얼 진화를 담은 자취실용서),https://search.shopping.naver.com/book/catalog/32456881687,https://shopping-phinf.pstatic.net/main_3245688/32456881687.20221227203103.jpg,노수봉,13320,팜파스,20170118,9791170261407,"오늘도 월세 벌러 출근하는 1인들,
독거하며 매일을 살아내는 자취인이라면 소름끼치게 공감할 이야기들

혼자서도 씩씩하게 살아가는 현 세상의 자취인류, 호모 자취엔스들을
프로자취인으로 거듭나게 해 줄 ‘전후무후 자취 실용서!’

아직은 1인 가구라는 말이 낯선 자취인들. 하루가 멀다 하고 뉴스로 쏟아져 나오는 1인 가구에 대한 소식들은 희망적이지 만은 않다. 코딱지만한 집의 월세가 헉! 소리 날 정도에, 집주인의 상상초월 횡포에 서러움을 삼킨다는 등의 비극적인 현실들이 보도된다. 하지만 혼자 사는 삶이 마냥 궁상맞고 서글프기만 한 것은 아니다. 부모님 집에서 독립해 ‘진짜 내 집 살림’을 꾸리고 사는 것은 의외로 재미나고 또 보람차다. 자취집의 가장이 되어 내가 나를 먹여 살리고, 또 구석구석 내가 디자인한 대로 만들고 유지해 나가며 ‘진짜 나’에 대해 온전히 생각하고 알게 되는 공간이기 때문이다."
7,오늘도 솔직하지 못했습니다 (자토의소소한자취일기 | 매일밤이불속에서울고웃는당신을위한핵소심돌직구),https://search.shopping.naver.com/book/catalog/32467092023,https://shopping-phinf.pstatic.net/main_3246709/32467092023.20230920071940.jpg,자토,11700,시공사,20160926,9788952776990,"『오늘도 솔직하지 못했습니다』는 꾸역꾸역 하루를 살아가는 직장인과 자취인들을 위한 에세이다. 자취 생활 10년, 회사 생활 5년 차의 ‘자토(자취 토끼, 본명 하지나)’가 그간 이불 속에서 되뇐 에피소드들을 담고 있다. 문득 이 세상이 버겁게 느껴진 날, 자토처럼 특초밥 세트를 앞에 두고 이렇게 외쳐보는 건 어떨까? “난이도 높은 세상, 어차피 살아가야 한다면 오늘도 즐겁게 살아주마”라고."
8,마음 오디세이아 1(큰글자도서) (그리스 여신들의 자취를 따라 떠나는 여행),https://search.shopping.naver.com/book/catalog/38341680620,https://shopping-phinf.pstatic.net/main_3834168/38341680620.20231031080005.jpg,고혜경,39000,나무연필,20230303,9791187890485,"그리스 신화는 우리 마음을 다채롭게 읽어내는 렌즈다
여신들의 드라마를 길잡이 삼아 탐색한 여성의 내면세계

고대 그리스 신화는 마르지 않는 샘물과도 같아서 오늘날에도 거듭 해석되어 관련 저작과 예술 작품이 생산되고 있다. 신화학 박사이자 심층심리학 연구자인 고혜경은 이 대열에 동참하여 머나먼 신화의 세계를 지금 이곳으로 불러온다. 마음의 원형이자 정신의 체현으로서 그리스 신들을 해석하고, 이를 바탕으로 현대인의 심리적 드라마를 파고들어 분석한다. 신화학을 바탕으로 심리학을 더해 펼쳐 보인 참신한 시도다.
이번 책에서 본격적으로 다룬 것은 올림포스를 대표하는 여섯 여신이다. 데메테르와 아테나를 통해서는 모녀와 부녀 사이의 끈끈한 결합에서 이어지는 빛과 그림자의 지형을 살핀다. 헤라를 거치면서 준엄한 혼인 서약을 맺은 뒤 펼쳐지는 부부의 세계를, 아르테미스를 경유하여 현대 여성에게 가장 미발달한 주제인 야성의 영역을 탐색한다. 아프로디테를 통해 아름다움과 사랑이 삶에 더하는 풍요를, 헤스티아를 통해서는 어지러운 세상에서 중심을 잡고 온기를 지켜 나가는 지혜를 짚어본다. 기록으로 남은 신화에 구전 설화와 고고학적 증거까지 참조하여 여신들의 세계를 풍부하게 해석해낸다.
그렇다면 신화는 어떻게 지금 우리의 마음을 읽는 길잡이가 될 수 있을까. 인간의 마음속에는 다양한 감정과 생각과 이미지가 있는데, 이들은 시시때때로 충돌한다. 외부적으로는 이분법과 흑백논리가 횡행하는 시대라 이 복잡다단한 마음을 다뤄내는 것은 더욱 만만치 않을 터. 심층심리학자로서 필자는 우리 마음의 다양한 면면을 잘 수용할 때 자기 자신에 대한 깊은 이해에 다다를 수 있고, 삶을 바라보는 다층적 시각이 마련된다고 말한다. 그리고 인간의 마음이 빚어낸 신화가 우리의 마음을 오롯이 수용하는 데 참조할 만한, 매우 유용한 텍스트임을 보여준다.
그리스의 신들은 심각하게 다툼을 벌이다가도 이내 화해하곤 한다. 제멋대로인 듯하지만 각자 고유한 영역과 힘을 철저히 존중하고, 그러면서도 각기 온전하다. 이처럼 서로 다른 것들이 만들어내는 조화, 그것이 올림포스의 이상이자 그리스 신화의 본질이라고 필자는 말한다. 그리스 신들의 세계를 거울삼아 복잡다단한 내면에 있는 각각의 힘들을 그 자체로 인정하면서 동시에 이들 사이의 조화를 모색하려 한다면, 그렇게 내딛는 발걸음이 바로 마음의 오디세이아일 것이다. 신화라는 새로운 렌즈를 통해 자신과 세상을 바라볼 때, 이제까지 미처 알지 못했던 것을 발견하게 될 것이다. 또 다른 세계를 만나게 될 것이다.

큰글자도서 소개
리더스원의 큰글자도서는 글자가 작아 독서에 어려움을 겪는 모든 분들에게 편안한 독서 환경을 제공함으로써 책 읽기의 즐거움을 되찾아 드리고자 합니다."
9,"셰익스피어 (런던에서 아테네까지, 셰익스피어의 450년 자취를 찾아)",https://search.shopping.naver.com/book/catalog/32460051870,https://shopping-phinf.pstatic.net/main_3246005/32460051870.20230131162742.jpg,황광수,16920,아르테(arte),20180417,9788950974107,"저자는 총 스물한 곳에 이르는 셰익스피어 작품의 배경지를 방문했으며, 이 책을 위해 셰익스피어 작품의 모든 인용문을 직접 우리말로 옮겼다. 또한 각 장이 끝날 때마다 셰익스피어의 사극과 시 시계, 그리고 셰익스피어 문학의 전체적 특징과 현재적 의미를 살펴보는 글을 실었다. 이 글들은 기행의 형식에 담지 못한 셰익스피어 문학의 성격과 내용을 좀 더 깊이 있게 다루고 있다.

이 책의 가장 큰 장점이자 다른 셰익스피어의 책들과 구분되는 특징은 단순히 셰익스피어의 생애와 작품에 대한 객관적 지식을 나열하는 데 그치지 않고, 인간 셰익스피어와 작가 셰익스피어에게 의미 있는 주요 장소들을 직접 찾아간 취재 기행의 기록이라는 점이다. 작가의 공간이 창작에 미친 영향을 이해하는 순간 작품은 더 깊은 내러티브를 갖게 된다."
0,마음 오디세이아 1 (그리스 여신들의 자취를 따라 떠나는 여행),https://search.shopping.naver.com/book/catalog/34541783618,https://shopping-phinf.pstatic.net/main_3454178/34541783618.20230919122433.jpg,고혜경,17100,나무연필,20220908,9791187890423,"내면 생태계는 단일하지 않다. 다면적이고 중심이 여럿이다. 서로 다른 욕구, 의도, 스타일, 방향성을 가진 다수가 공존하니 복잡다단할 수밖에 없다. 상호 모순된 감정 때문에 마음이 찢기고, 이러지도 저러지도 못한 채 헤어나지 못하고, 내 마음을 나도 모르겠다는 탄식을 뱉는 것은 이 때문이다. 고대 그리스는 다중심적인 마음 패턴을 풍성하고 정교하게 그려낸, 지구상에 전무후무한 신화권이다. 여기에서 피어난 다신관은 복잡다단한 인간 정신을 상상하는 데 매우 빼어난 은유다. 다름을 존중하는 가운데 균형과 조화를 꾀하는 것, 이것이 그리스의 이상이다. 
따라서 그리스 신화는 ‘잘 분화된 통합’ 혹은 ‘다채로운 조화’를 모색하는 심리학적 모델이기도 하다. 이 책은 흑백논리나 이분법으로 인해 극단으로 분열되어 신음하는 현시대에 대한 심리학적 대안을 모색해본 작업이다. 그리스인의 방식으로, 우리 모두 그리스인이 되어 동시대의 내면을 탐색하고 진단해보고자 펼친 장이다. _‘머리말’에서"
