,title,link,image,author,discount,publisher,pubdate,isbn,description
0,자취생 사로잡는 101가지 요리비법,https://search.shopping.naver.com/book/catalog/32441513698,https://shopping-phinf.pstatic.net/main_3244151/32441513698.20230427071839.jpg,김경미,13500,파프리카(교문사),20090723,9788936310035,"준비해야 될 것이 너무 많은 요리책에 반감을 갖고 있는 사람을 위한 요리책

혼자 사는 사람들은 밖에서 밥을 사 먹거나 끼니를 대강 해결하는 경우가 많다. 사람이 매번 집에서 한 끼 잘 차려 먹기가 쉽지 않기 때문이다. 싱글족들의 이유 없는 굶주림을 해결하기 위해 전직 비서, 간호사이자 바리스타, 국어강사 등으로 활동했던 7명의 싱글들이 뭉쳤다."
1,"1인 가구 맞춤 요리책 (자취생, 싱글 직장인, 기러기아빠, 주말부부까지 혼자서 잘 차려먹기)",https://search.shopping.naver.com/book/catalog/32485083203,https://shopping-phinf.pstatic.net/main_3248508/32485083203.20220527024837.jpg,월간 수퍼레시피,0,레시피팩토리,20131218,9791185473000,"1인 가구들의 목소리를 적극 반영한 맞춤 레피시!

작은 주방에서 적은 재료로 만드는 1인 가구 맞춤 메뉴 150개 『1인 가구 맞춤 요리책』. 자취생, 싱글 직장인, 기러기 아빠까지 늘어나는 1인 가구를 위한 맞춤 메뉴를 소개한 책이다. 요리잡지 ‘수퍼레시피’에서 진행한 독자 모임의 의견을 바탕으로 최소한의 조리도구, 양념, 재료들을 사용한 메뉴들을 엄선했다.

칼질을 많이 해야 하는 조리법은 피하고, 후다닥 볶아내는 조리법, 냉동했다가 해동해도 질감 차이가 크지 않은 재료를 활용한 레시피를 다양하게 담았다. 또한 친구들이 놀러 왔을 때 후다닥 만들 수 있는 조금 폼나는 안주 겸용 메뉴들까지 1인 가구만을 위한 요리들을 충실하게 선보인다. 더불어 남는 재료와 음식처리, 남은 음식 새롭게 활용하는 방법 등 혼자 사는 사람들의 실질적인 고민들을 반영하여 고충을 해결한다."
